comments,posted,subreddit,titles
439 comments,2 hours ago,r/gifs,Dad prevents crash. (i.imgur.com)
472 comments,3 hours ago,r/DadReflexes,Dad reflexes prevent crash.★★★★★ Dad Reflex (i.imgur.com)
153 comments,2 hours ago,r/sports,Synced videos of the Eagles fan running into the pillar (v.redd.it)
265 comments,3 hours ago,r/FellowKids,Legit the best place for your squad to stay woke...True FellowKids (i.imgur.com)
1035 comments,5 hours ago,r/gaming,My friend playing Mario Odyssey during class (i.redd.it)
753 comments,5 hours ago,r/ChoosingBeggars,Quite literally choosing beggar (i.imgur.com)
139 comments,4 hours ago,r/wholesomebpt,One of the best feelings ever (i.imgur.com)
746 comments,5 hours ago,r/funny,When your cat crashes his bicycle in his dream... (v.redd.it)
564 comments,6 hours ago,r/interestingasfuck,A tower of giraffes out for a run/r/ALL (i.imgur.com)
2896 comments,6 hours ago,r/dataisbeautiful,Heatmap of numbers found at the end of Reddit usernames [OC]OC (i.redd.it)
331 comments,5 hours ago,r/Futurology,Tesla’s giant battery in Australia made around $1 million in just a few daysEnergy (electrek.co)
421 comments,5 hours ago,r/oldpeoplefacebook,Hre you OPEN TODAY (i.redd.it)
1662 comments,7 hours ago,r/gaming,Trying to pacifist run SuperHot is insane. (gfycat.com)
273 comments,7 hours ago,r/standupshots,Sartre Day Night Live (i.imgur.com)
350 comments,6 hours ago,r/worldnews,Greece to legalize Medical Marijuana in February (cnednews.com)
1032 comments,7 hours ago,r/science,"Psychedelic mushrooms reduce authoritarianism and boost nature relatedness, experimental study suggestsPsychology (psypost.org)"
797 comments,7 hours ago,r/oddlysatisfying,IBM Ball Head typewriter (i.imgur.com)
56 comments,4 hours ago,r/fakehistoryporn,WWI veteran is compared to his pre-war passport photo (circa 1918 - colourised) (i.redd.it)
341 comments,5 hours ago,r/instant_regret,The flaming flip off (v.redd.it)
612 comments,7 hours ago,r/WeWantPlates,"""I Put Fries in an Enclosed Bowl So They Steam and Get Soggy"" - Some Prick Cook (i.redd.it)"
151 comments,7 hours ago,r/evilbuildings,Welcome to MetropolisstaTuesday (i.imgur.com)
2221 comments,7 hours ago,r/PoliticalHumor,The Corruption Cycle (images.dailykos.com)
348 comments,7 hours ago,r/photoshopbattles,PsBattle: Prize Winning CakePhotoshops Only Mode | Cutout in Comments (static.keptelenseg.hu)
228 comments,4 hours ago,r/pics,So it snowed on the cabbage field... (i.redd.it)
1095 comments,7 hours ago,r/pics,These traffic lights in the Ukraine. (i.imgur.com)
